{
  "knowledgeVersion": 1,
  "generatedAt": "2026-05-21T00:00:00.000Z",
  "scope": ["docs/data-source"],
  "actors": [
    {
      "id": "actor.customer",
      "name": "Customer",
      "description": "End user placing orders"
    }
  ],
  "useCases": [
    {
      "id": "UC-01",
      "title": "Place order",
      "priority": "High",
      "description": "Customer submits an order for fulfillment"
    }
  ],
  "features": [
    {
      "id": "F-01",
      "title": "Checkout",
      "description": "Cart and payment flow",
      "satisfies": ["UC-01"]
    }
  ],
  "functionalRequirements": [],
  "nfrs": [],
  "entities": [],
  "interfaces": [],
  "constraints": [],
  "openQuestions": []
}
